{"$defs":{"capabilityState":{"enum":["unavailable","offline-validated","gpu-validated","failed"]},"completenessState":{"enum":["planned","running","complete","partial","corrupt","failed"]},"contentRef":{"additionalProperties":false,"properties":{"id":{"$ref":"#/$defs/identifier"},"kind":{"$ref":"#/$defs/identifier"},"schema_version":{"const":"1.0.0"},"sha256":{"$ref":"#/$defs/sha256"},"uri":{"minLength":1,"type":"string"}},"required":["schema_version","kind","id","sha256","uri"],"type":"object"},"identifier":{"pattern":"^[a-z0-9][a-z0-9._:-]{2,127}$","type":"string"},"moduleKind":{"enum":["router-logits","router-probabilities","route-selection","routing-weights","shared-expert-output","residual-stream","attention-input","attention-output","attention-summary","mlp-input","mlp-output","expert-input","expert-output","decoder-logits","token-confidence","kv-metadata","quantization-metadata","runtime-metadata","modality-encoder","modality-projection"]},"sha256":{"pattern":"^[0-9a-f]{64}$","type":"string"}},"$id":"https://inkling-small-ampere.invalid/schemas/mechanistic/v1/MechanisticRunManifest.schema.json","$schema":"https://json-schema.org/draft/2020-12/schema","additionalProperties":false,"properties":{"batch_size":{"const":1},"capture_profile_ref":{"$ref":"#/$defs/contentRef"},"completeness":{"$ref":"#/$defs/completenessState"},"execution_path":{"enum":["reference-eager","pinned-vllm-observation"]},"hardware":{"additionalProperties":false,"properties":{"accelerator":{"minLength":1,"type":"string"},"accelerator_count":{"minimum":1,"type":"integer"},"cuda_runtime_version":{"type":"string"},"device_uuids":{"items":{"minLength":1,"type":"string"},"minItems":1,"type":"array","uniqueItems":true},"driver_version":{"type":"string"},"evidence_state":{"$ref":"#/$defs/capabilityState"},"interconnect":{"type":"string"},"machine_type":{"$ref":"#/$defs/identifier"},"no_resource_provisioned":{"type":"boolean"}},"required":["machine_type","accelerator","accelerator_count","evidence_state","no_resource_provisioned"],"type":"object"},"id":{"$ref":"#/$defs/identifier"},"identities":{"additionalProperties":false,"properties":{"checkpoint":{"$ref":"#/$defs/contentRef"},"conversion":{"$ref":"#/$defs/contentRef"},"image":{"$ref":"#/$defs/contentRef"},"prompt_payload":{"$ref":"#/$defs/contentRef"},"runtime":{"$ref":"#/$defs/contentRef"},"runtime_patchset":{"$ref":"#/$defs/contentRef"},"serving_profile":{"$ref":"#/$defs/contentRef"}},"required":["checkpoint","conversion","runtime","runtime_patchset","image","serving_profile","prompt_payload"],"type":"object"},"intervention_ref":{"$ref":"#/$defs/contentRef"},"kind":{"const":"mechanistic-run-manifest"},"matched_control_run_ref":{"$ref":"#/$defs/contentRef"},"observation_only":{"type":"boolean"},"probe_set_ref":{"$ref":"#/$defs/contentRef"},"schema_version":{"const":"1.0.0"},"seed":{"minimum":0,"type":"integer"},"tp":{"additionalProperties":false,"properties":{"barrier_policy":{"const":"pre-finalize-and-post-flush"},"rank_order":{"items":{"minimum":0,"type":"integer"},"type":"array"},"world_size":{"minimum":1,"type":"integer"}},"required":["world_size","rank_order","barrier_policy"],"type":"object"},"transport":{"enum":["responses-only","offline-tokenized-eager"]}},"required":["schema_version","kind","id","execution_path","probe_set_ref","capture_profile_ref","identities","seed","hardware","tp","batch_size","transport","observation_only","completeness"],"title":"MechanisticRunManifest","type":"object"}
